{
  "@context": [
    "https://www.w3.org/ns/credentials/v2",
    "https://w3id.org/qi-vc/contexts/v1/qi-evidence-context.jsonld",
    "https://w3id.org/qi-vc/contexts/v1/qi-rm.jsonld"
  ],
  "id": "urn:uuid:rm-cert-sd-001",
  "type": [
    "VerifiableCredential",
    "ReferenceMaterialCertificate"
  ],
  "issuer": "did:web:rm-producer.example",
  "validFrom": "2026-02-01T00:00:00Z",
  "validUntil": "2028-02-01T00:00:00Z",
  "credentialSchema": {
    "id": "https://w3id.org/qi-vc/schemas/v1/reference-material-certificate.json",
    "type": "JsonSchema"
  },
  "credentialSubject": {
    "id": "urn:example:lot:rm-CuZn-001",
    "administrativeData": {
      "coreData": {
        "titleOfTheDocument": "Reference Material Certificate",
        "uniqueIdentifier": "M375a"
      },
      "validity": {
        "validFrom": "2026-02-01",
        "validUntil": "2028-02-01"
      },
      "referenceMaterialProducer": {
        "id": "did:web:rm-producer.example",
        "name": "Example Reference Material Producer (fictional)"
      }
    },
    "materials": [
      {
        "name": "M375a",
        "matrix": "CuZn39Pb3 (leaded brass)",
        "form": "disc",
        "materialIdentifiers": [
          {
            "type": "lotNumber",
            "value": "M375a"
          }
        ]
      }
    ],
    "materialPropertiesList": [
      {
        "propertyIdentifiers": [
          "Cu",
          "Pb",
          "As"
        ],
        "isCertified": true,
        "results": [
          {
            "name": "Copper (Cu)",
            "scopeRef": "scope-entry-Cu-CuZn",
            "data": {
              "quantity": {
                "quantityKind": "http://qudt.org/vocab/quantitykind/MassFraction",
                "value": 57.68,
                "unit": {
                  "ucumCode": "%"
                },
                "uncertainty": {
                  "expandedUncertainty": 0.14,
                  "coverageFactor": 2
                }
              }
            }
          },
          {
            "name": "Lead (Pb)",
            "scopeRef": "scope-entry-Pb-CuZn",
            "data": {
              "quantity": {
                "quantityKind": "http://qudt.org/vocab/quantitykind/MassFraction",
                "value": 3.07,
                "unit": {
                  "ucumCode": "%"
                },
                "uncertainty": {
                  "expandedUncertainty": 0.06,
                  "coverageFactor": 2
                }
              }
            }
          },
          {
            "name": "Arsenic (As)",
            "scopeRef": "scope-entry-As-CuZn",
            "data": {
              "quantity": {
                "quantityKind": "http://qudt.org/vocab/quantitykind/MassFraction",
                "value": 178,
                "unit": {
                  "ucumCode": "mg/kg"
                },
                "uncertainty": {
                  "expandedUncertainty": 5,
                  "coverageFactor": 2
                }
              }
            }
          }
        ]
      }
    ]
  },
  "evidence": [
    {
      "type": "CredentialEvidenceReference",
      "id": "urn:uuid:operational-scope-001",
      "relation": "authorizedBy",
      "authorizationBasis": {
        "kind": "operationalScope",
        "issuerRole": "referenceMaterialProducer"
      }
    }
  ],
  "proof": {
    "type": "DataIntegrityProof",
    "created": "2026-10-12T19:39:15Z",
    "verificationMethod": "did:web:rm-producer.example#key-2",
    "cryptosuite": "ecdsa-sd-2023",
    "proofPurpose": "assertionMethod",
    "proofValue": "u2V0BhVhAbhW5qv3KKIaP813T7oEqmefqsxuCXRfnE43S56bX_3bkQjX5AbPTEwl4K3nZhionCofpl4D2vmVP3efw2d2IF1gjgCQDkw4dgBgVQiBKVhrtxcEoy-wEUFByq5JprPZShXJRBwCArQBYIGWsjFY5bHdG6FeSsjMFvDrTxgLNxETYZaVUDVJ1oyL7AVgg18APbzQi7eqKUaubRcO5Ix_Fa0L5HjgyiXq9CtruAuYCWCCmpmW10rItMdk8dKYHNhWkng2eA_2JObhgbgPzpDXuHANYIE25tYCyZggmZ3zgN0GT1BZauliIpuLE_YyzlHe4u7VMBFggpgzXdSGInyYqQeTrlaXd3NpO61w4EiWMGF5t153vhOwFWCDxDXcslWMQEL00trLHFMj-bUNC48qWCWC_Fp0U2TuymAZYIHVuxXtkBh7bAgvwKrf1byoFg8OhO_RKP-T4fJgpsqF3B1gg5To0xW3lwxylfcyxBGNk_1oa1HTjwH6gCPN2eJY_QBcIWCBD09t3w9WXRXQttzpzLJQYTyZGpMtep-_nh4n-1-OGKwlYIAciFhHMKaQHzGS6ybOlBja0mPucj47VkoCGGp-BMkr5Clgg_qgDT1Mp21IDFMXCs_XU5XCv3RSdsW5_UOEgEUwbrvELWCB7kKfnF98Xbwe5syF2mQ7PbhbXadXjoVQxu_ZFv1fqeAxYIBFpRvOD2Up4xYmc1W4B9BFRnuqEmS9dJeopb0NhTFuimDIAAQIDBAUGBwgJCgsMDQ4PEBESExQVFhcYGBgZGBoYGxgcGB0YHhgfGCAYIRgiGCMYJBglGCYYJxgoGCkYKhgrGCwYLRguGC8YMBgx"
  }
}
