{
  "$schema": "https://w3id.org/qi-vc/schemas/v1/reference-material-certificate.json",
  "@context": [
    "https://www.w3.org/ns/credentials/v2",
    "https://w3id.org/qi-vc/contexts/v1/qi-evidence-context.jsonld",
    "https://w3id.org/qi-vc/contexts/v1/qi-rm.jsonld"
  ],
  "type": [
    "VerifiableCredential",
    "ReferenceMaterialCertificate"
  ],
  "id": "urn:uuid:rm-cert-001",
  "issuer": "did:web:rm-producer.example",
  "validFrom": "2026-02-01T00:00:00Z",
  "validUntil": "2028-02-01T00:00:00Z",
  "credentialSchema": {
    "id": "https://w3id.org/qi-vc/schemas/v1/reference-material-certificate.json",
    "type": "JsonSchema"
  },
  "credentialSubject": {
    "id": "urn:example:lot:rm-CuZn-As-001",
    "administrativeData": {
      "coreData": {
        "titleOfTheDocument": "Reference Material Certificate",
        "uniqueIdentifier": "RMC-CuZn-As-001"
      },
      "validity": {
        "validFrom": "2026-02-01",
        "validUntil": "2028-02-01"
      },
      "referenceMaterialProducer": {
        "id": "did:web:rm-producer.example",
        "name": "Reference Material Producer"
      }
    },
    "materials": [
      {
        "name": "CuZn39Pb3 (leaded brass)",
        "matrix": "CuZn39Pb3 (leaded brass)",
        "form": "disc",
        "materialIdentifiers": [
          {
            "type": "lotNumber",
            "value": "RM-CuZn-As-001"
          }
        ]
      }
    ],
    "materialPropertiesList": [
      {
        "propertyIdentifiers": [
          "As"
        ],
        "isCertified": true,
        "results": [
          {
            "name": "Arsenic (As)",
            "scopeRef": "scope-entry-As-CuZn",
            "data": {
              "quantity": {
                "quantityKind": "http://qudt.org/vocab/quantitykind/MassFraction",
                "value": 178,
                "unit": {
                  "ucumCode": "mg/kg"
                },
                "uncertainty": {
                  "expandedUncertainty": 5,
                  "coverageFactor": 2
                }
              }
            }
          }
        ]
      }
    ]
  },
  "evidence": [
    {
      "type": "CredentialEvidenceReference",
      "id": "urn:uuid:operational-scope-001",
      "relation": "authorizedBy",
      "authorizationBasis": {
        "kind": "operationalScope",
        "issuerRole": "referenceMaterialProducer"
      },
      "digestSRI": "sha384-AxPj9zjN8OUI+0mJa1ZFOoZhFMYt0NLE5ru5s2xz1QRcf2r3Bba/51HiqR6T2nVw"
    },
    {
      "type": "CredentialEvidenceReference",
      "id": "urn:uuid:rm-study-001",
      "relation": "supportedBy",
      "digestSRI": "sha384-iDr/A2IwfbSpeFh2ZdgY02hF7bXaMGyaMmd4PmqNig1ACCJ/iIkuJg9pIUUUPPRV"
    }
  ],
  "proof": {
    "type": "DataIntegrityProof",
    "cryptosuite": "eddsa-rdfc-2022",
    "proofPurpose": "assertionMethod",
    "verificationMethod": "did:web:rm-producer.example#key-1",
    "created": "2026-01-01T00:00:00Z",
    "proofValue": "zPlaceholderProof"
  }
}
